{
  "protocol": "commitment/v1",
  "kind": "verification",
  "verificationRunId": "e0000000-0000-4000-8000-000000000001",
  "missionId": "11111111-1111-4111-8111-111111111111",
  "pactDigest": "HnavHPOFRHxw1qf08QBBLrhuPFU--glfe0cO4PROY3U",
  "attempt": 1,
  "status": "passed",
  "verifier": {
    "verifierId": "accessibility-dungeon-v1",
    "version": "1.0.0"
  },
  "infrastructureStatus": "available",
  "criteria": [
    {
      "criterionId": "a0000000-0000-4000-8000-000000000004",
      "status": "passed",
      "artifactIds": ["c0000000-0000-4000-8000-000000000001"],
      "evidence": "All expected findings were present exactly once."
    },
    {
      "criterionId": "a0000000-0000-4000-8000-000000000005",
      "status": "passed",
      "artifactIds": ["c0000000-0000-4000-8000-000000000002"],
      "evidence": "Every remediation referenced an accepted finding."
    }
  ],
  "correctionConsumed": false,
  "startedAt": "2026-08-26T12:50:00.000Z",
  "completedAt": "2026-08-26T12:50:01.000Z"
}
